{
  "schema_version": "1.0.0",
  "policy_id": "CONDOR-CS-EN",
  "version": "0.1.0",
  "title": "Condor Customer Service Operator Policy",
  "language": "en",
  "status": "draft_review_required",
  "created_on": "2026-10-30",
  "review_due_on": "2026-11-30",
  "owner_role": "Customer Care Policy",
  "scope": {
    "channels": [
      "call",
      "email"
    ],
    "jurisdiction": [
      "EU261 covered journeys",
      "German consumer law where applicable",
      "Montreal Convention where applicable"
    ],
    "business_volume_assumption_per_year": 120000,
    "legal_profile": {
      "id": "EU261-PRE-2027",
      "event_date_from": "2005-02-17",
      "event_date_to_exclusive": "2027-10-23",
      "future_profile_status": "not_implemented"
    },
    "demo_only": true,
    "production_execution_enabled": false
  },
  "approval": {
    "legal": null,
    "operations": null,
    "finance": null,
    "privacy": null,
    "ste_specialist": null
  },
  "language_profile": {
    "standard": "ASD-STE100 Issue 9",
    "status": "controlled_english_draft_vocabulary_review_required",
    "procedural_sentence_max_words": 20,
    "descriptive_sentence_max_words": 25
  },
  "precedence": [
    "applicable_binding_law_and_court_interpretation",
    "valid_individual_contract",
    "approved_operating_policy",
    "public_carrier_explanation"
  ],
  "mandatory_rule_ids": [
    "GOV-001",
    "GOV-002",
    "INT-002",
    "INT-003",
    "EVID-001",
    "TIME-001",
    "FIN-001",
    "AI-001",
    "RAG-001"
  ],
  "table_rule_ids": [
    "CAN-002",
    "DEL-001",
    "COMP-001",
    "DOWN-001",
    "ADR-001",
    "ESC-001",
    "OPS-001"
  ],
  "rules": [
    {
      "rule_id": "GOV-001",
      "title": "Apply the correct authority",
      "topic": "governance",
      "rule_kind": "operating_control",
      "trigger": "For each case.",
      "required_facts": [],
      "instructions": [
        "Use the law that applies to the event date and the route.",
        "Apply binding law before a fare term or an internal rule.",
        "Use Court of Justice interpretations when you apply EU law.",
        "Do not treat an interpretative notice as binding legislation.",
        "Use a fare term only after you check the contract version.",
        "If sources conflict, send the conflict to Legal.",
        "Continue clear assistance duties during the legal review.",
        "Do not use this draft as an approved Condor policy."
      ],
      "prohibited_actions": [
        "Do not reduce a legal right to meet an internal budget."
      ],
      "source_refs": [
        {
          "source_id": "EU261",
          "locator": "Article 15"
        },
        {
          "source_id": "BGB307",
          "locator": "Section 307"
        }
      ],
      "related_rule_ids": [
        "GOV-002",
        "RAG-001"
      ],
      "keywords": []
    },
    {
      "rule_id": "GOV-002",
      "title": "Select the policy by event date",
      "topic": "governance",
      "rule_kind": "legal_rule",
      "trigger": "Before you assess a legal right.",
      "required_facts": [
        "event_date",
        "route",
        "operating_carrier"
      ],
      "instructions": [
        "Confirm the event date before you select this legal profile.",
        "Use this EU261 profile for events from 17 February 2005 through 22 October 2027.",
        "Apply separate date checks for Montreal limits.",
        "Regulation (EU) 2026/2202 applies from 23 October 2027.",
        "For events from that date, request the approved replacement profile.",
        "Do not apply the future rules early.",
        "Send unclear transitional cases to Legal.",
        "Record the selected profile and the policy version."
      ],
      "prohibited_actions": [],
      "source_refs": [
        {
          "source_id": "EU261",
          "locator": "Article 19"
        },
        {
          "source_id": "EU261-2027",
          "locator": "Article 3"
        }
      ],
      "related_rule_ids": [],
      "keywords": []
    },
    {
      "rule_id": "INT-001",
      "title": "Open one case across channels",
      "topic": "intake",
      "rule_kind": "operating_control",
      "trigger": "When a call or an email arrives.",
      "required_facts": [
        "channel",
        "received_at",
        "contact_reference"
      ],
      "instructions": [
        "Record the receipt time in UTC.",
        "Create a case identifier.",
        "Search for an existing case before you open another case.",
        "Link each call, email and attachment to the case.",
        "Separate each passenger and each claim type within the case.",
        "Record the flight date, route and operating carrier.",
        "Record the requested result in the customer's words.",
        "Record facts separately from allegations.",
        "Record the source and confidence for each extracted fact.",
        "Do not use a message subject as proof of entitlement."
      ],
      "prohibited_actions": [],
      "source_refs": [],
      "related_rule_ids": [],
      "keywords": [
        "phone",
        "call center",
        "contact centre",
        "email",
        "complaint"
      ]
    },
    {
      "rule_id": "INT-002",
      "title": "Check identity and representative authority",
      "topic": "intake",
      "rule_kind": "operating_control",
      "trigger": "Before you disclose booking data or change a booking.",
      "required_facts": [],
      "instructions": [
        "Use the approved identity check for the requested action.",
        "Use more than a booking reference for a financial change.",
        "Check a representative's authority before you disclose passenger data.",
        "Check an assignment before you select the compensation payee.",
        "Do not request a passport copy as a default identity check.",
        "Use the secure channel for bank details.",
        "Do not collect a card security code in case notes.",
        "If identity data are missing, request only the necessary data.",
        "Continue general rights information without booking disclosure."
      ],
      "prohibited_actions": [],
      "source_refs": [
        {
          "source_id": "GDPR",
          "locator": "Articles 5, 6, 32"
        }
      ],
      "related_rule_ids": [
        "PRIV-001",
        "FIN-001"
      ],
      "keywords": []
    },
    {
      "rule_id": "INT-003",
      "title": "Classify all issues",
      "topic": "intake",
      "rule_kind": "operating_control",
      "trigger": "After you read the customer request.",
      "required_facts": [],
      "instructions": [
        "Create separate issues for compensation, ticket refunds, expenses and goodwill.",
        "Include baggage, booking changes and service failures when relevant.",
        "Assess each issue under its own legal basis.",
        "Do not replace a statutory payment with goodwill.",
        "Do not require receipts for fixed EU261 compensation.",
        "Use sentiment only to adapt tone and service priority.",
        "Do not change entitlement because the customer is angry.",
        "Do not hand over a supported case because it has multiple issues."
      ],
      "prohibited_actions": [],
      "source_refs": [],
      "related_rule_ids": [
        "EVID-001",
        "ESC-001"
      ],
      "keywords": []
    },
    {
      "rule_id": "EVID-001",
      "title": "Request only missing evidence",
      "topic": "evidence",
      "rule_kind": "operating_control",
      "trigger": "When a necessary fact is unknown.",
      "required_facts": [
        "missing_fact_names",
        "available_internal_records"
      ],
      "instructions": [
        "Check the booking and flight records first.",
        "Ask for each missing fact in one clear request.",
        "Explain why you need each item.",
        "Accept an equivalent reliable record when an original receipt is unavailable.",
        "Keep the claim open during a reasonable evidence period.",
        "Do not restart a legal deadline when evidence arrives.",
        "Do not treat missing evidence as fraud.",
        "Do not hand over a case for missing evidence alone.",
        "After the reply, assess the same case again.",
        "If a material conflict remains, record the conflict for a specialist."
      ],
      "prohibited_actions": [],
      "source_refs": [],
      "related_rule_ids": [
        "OPS-002",
        "ESC-001"
      ],
      "keywords": []
    },
    {
      "rule_id": "EU-001",
      "title": "Check EU261 scope",
      "topic": "eu261_scope",
      "rule_kind": "legal_rule",
      "trigger": "For disruption compensation or assistance.",
      "required_facts": [
        "route",
        "event_date",
        "operating_carrier",
        "booking_status",
        "check_in_status"
      ],
      "instructions": [
        "Check the departure airport against the applicable EU territory list.",
        "For an EU departure, assess any operating carrier.",
        "For a third-country departure, check EU arrival and EU operating-carrier status.",
        "Check the Article 3 exception for benefits and assistance in a third country.",
        "Check the confirmed reservation and the applicable check-in rule.",
        "If no written check-in time exists, use 45 minutes before published departure.",
        "Do not require check-in for a cancelled flight.",
        "Check transferred passengers under Article 3(2)(b).",
        "Include public loyalty tickets.",
        "Check free travel and non-public reduced fares under Article 3(3).",
        "For EEA, Swiss or UK coverage, obtain the applicable jurisdiction profile.",
        "Do not reject a connecting journey from a single segment alone."
      ],
      "prohibited_actions": [],
      "source_refs": [
        {
          "source_id": "EU261",
          "locator": "Articles 2 and 3"
        },
        {
          "source_id": "EU-RIGHTS",
          "locator": "EU scope"
        }